objectId,objectUrl,images,title,object_name,artist,date,description,dimensions,credit_line,collection,object_number
F39718AD-FAAE-4DF1-9BC7-652968923510,https://hiculturearts.pastperfectonline.com/webobject/F39718AD-FAAE-4DF1-9BC7-652968923510,['https://s3.amazonaws.com/pastperfectonline/images/museum_220/003/19952108.jpg'],"Punaluu Black Sands Beach, Hawaii",Poster,Bill Braden,1995,"Poster from Bill Braden's ""Best Beaches of Hawaii"" series.",H-20.25 W-16.875 D-0.75 inches,City and County of Honolulu Purchase,Mayor's Office of Culture & the Arts Collection,1995.21.08
7936BCB8-62B2-43E3-B624-281127369976,https://hiculturearts.pastperfectonline.com/webobject/7936BCB8-62B2-43E3-B624-281127369976,['https://s3.amazonaws.com/pastperfectonline/images/museum_220/003/19952104.jpg'],"Punaluu Black Sands Beach, Kauai",Print,Bill Braden,,Serigraph,,City and County of Honolulu Purchase,Mayor's Office of Culture & the Arts Collection,1995.21.04
6256DE11-87B0-45B4-A861-876754781063,https://hiculturearts.pastperfectonline.com/webobject/6256DE11-87B0-45B4-A861-876754781063,['https://s3.amazonaws.com/pastperfectonline/images/museum_220/001/197559.jpg'],Punaluu Oahu,Painting,Viki Snyder,1975,,H-26 W-30 inches,City and County of Honolulu Purchase,City & County of Honolulu,1975.59
8BBABF94-159D-4D51-A3F6-379106348529,https://hiculturearts.pastperfectonline.com/webobject/8BBABF94-159D-4D51-A3F6-379106348529,"['https://s3.amazonaws.com/pastperfectonline/images/museum_220/001/195801.jpg', 'https://s3.amazonaws.com/pastperfectonline/images/museum_220/001/195801-2.jpg']",Pure Water - Man's Greatest Need,Mural,Juliette May Fraser,1958,"A mural depicting various agricultural activities occurring in Hawaii over several time periods, from pre-contact to the 20th century. Located in the Board of Water Supply Building Lobby.",H-72 W-477 inches,,Board of Water Supply Collection,1958.01
A1ADAF3B-08BA-47ED-ABE2-079405455030,https://hiculturearts.pastperfectonline.com/webobject/A1ADAF3B-08BA-47ED-ABE2-079405455030,['https://s3.amazonaws.com/pastperfectonline/images/museum_220/001/195902.jpg'],Pure Water Man's Greatest Need,Door,"Wood, Weed & Associates",1959,Two pairs of etched steel panels on steel elevator doors of  scenes relating to water and depicting a figure in traditional Hawaiian dress. Located at the Board of Water Supply main building's first floor elevators.,H-12 W-10.375 inches,,Board of Water Supply Collection,1959.02
4695B6E5-E63E-4672-A0FA-620625493803,https://hiculturearts.pastperfectonline.com/webobject/4695B6E5-E63E-4672-A0FA-620625493803,['https://s3.amazonaws.com/pastperfectonline/images/museum_220/002/19940605.jpg'],Puu Kapolei Heiau,"Print, Photographic",Anne Landgraf,1989,Hand etched silver gelatin print.,H-23 W-28 inches,City and County of Honolulu Purchase,City & County of Honolulu,1994.06.05
C72DBF3F-B628-46B8-AC17-408927920330,https://hiculturearts.pastperfectonline.com/webobject/C72DBF3F-B628-46B8-AC17-408927920330,['https://s3.amazonaws.com/pastperfectonline/images/museum_220/002/19910201.jpg'],Puuomahana Bluff Overlooking...,Painting,Margaret Fleming Waldron,1968,Large modern seascape depicting a small rocky cove with three seabirds on the lower right recto foreground.,H-54.5 W-153 inches,Gift of Arcadia Retirement Residence,City & County of Honolulu,1991.02.01
7F88D097-5EFB-47FC-A4EE-979910497608,https://hiculturearts.pastperfectonline.com/webobject/7F88D097-5EFB-47FC-A4EE-979910497608,['https://s3.amazonaws.com/pastperfectonline/images/museum_220/002/19910101.jpg'],Puinokolu A Hina,Print,Dietrich Varez,1991,Woodblock print.,H-23.625 W-29 inches,,City & County of Honolulu,1991.01.01
D2C0ADA3-4C2D-43C4-8389-530398409740,https://hiculturearts.pastperfectonline.com/webobject/D2C0ADA3-4C2D-43C4-8389-530398409740,"['https://s3.amazonaws.com/pastperfectonline/images/museum_220/006/195001-2.jpg', 'https://s3.amazonaws.com/pastperfectonline/images/museum_220/008/195001-3.jpg']",Queen Emma,Bust,Alice Lenning Campbell,1949,"A terracotta bust of Queen Emma with her hair drawn up from her face and neck, and pinned. She wears a tiara of leaf, vein-like incised lins with flattened round shapes along the horizontal central stem in her hair. A pendulum shaped earring appears on her proper right ear. Originally installed on a pedestal at Queen Emma Square.",H-18 W-14 D-12 inches,Gift of Mrs. Walter F. Dillingham,City & County of Honolulu,1950.01
00ECB8F8-0B0D-42EB-B50F-518178216560,https://hiculturearts.pastperfectonline.com/webobject/00ECB8F8-0B0D-42EB-B50F-518178216560,"['https://s3.amazonaws.com/pastperfectonline/images/museum_220/003/199905.jpg', 'https://s3.amazonaws.com/pastperfectonline/images/museum_220/003/199905-2.jpg', 'https://s3.amazonaws.com/pastperfectonline/images/museum_220/003/199905-3.jpg']",Queen Emma,Bust,Ron Smith,1999,"Bronze bust of Queen Emma. Plaque reads ""Queen Emma 1836-1885."" Located in Queen Emma Square.",H-20 W-19 D-11 inches,City and County of Honolulu Purchase,City and County of Honolulu Collection,1999.05
56C88665-275B-45D3-822B-440902915374,https://hiculturearts.pastperfectonline.com/webobject/56C88665-275B-45D3-822B-440902915374,"['https://s3.amazonaws.com/pastperfectonline/images/museum_220/003/200106.jpg', 'https://s3.amazonaws.com/pastperfectonline/images/museum_220/003/200106-2.jpg', 'https://s3.amazonaws.com/pastperfectonline/images/museum_220/003/200106-3.jpg', 'https://s3.amazonaws.com/pastperfectonline/images/museum_220/003/200106-4.jpg']",Queen Kapiolani,Sculpture,Holly Young,2001,Life-size colored bronze figure of Queen Kapiolani. Located near the Kapiolani Park Bandstand.,H-78 W-32 D-32 inches,City and County of Honolulu Purchase,City and County of Honolulu Collection,2001.06
ACA0EF9D-BB29-4D1F-BD48-951782786300,https://hiculturearts.pastperfectonline.com/webobject/ACA0EF9D-BB29-4D1F-BD48-951782786300,['https://s3.amazonaws.com/pastperfectonline/images/museum_220/003/199517.jpg'],Rain Temple Tea,Teapot,Gail Bakutis,1994,Raku fired ceramic teapot.,H-32 W-18 D-19 inches,City and County of Honolulu Purchase,City & County of Honolulu,1995.17
2C9E7E4E-0402-46C9-B1E7-648056398834,https://hiculturearts.pastperfectonline.com/webobject/2C9E7E4E-0402-46C9-B1E7-648056398834,['https://s3.amazonaws.com/pastperfectonline/images/museum_220/002/19930602.jpg'],Rain: One Record After Another,Print,Laura Smith,1993,Woodcut screenprint.,,City and County of Honolulu Purchase,City & County of Honolulu,1993.06.02
1AC8A976-5056-4702-98D9-229431301805,https://hiculturearts.pastperfectonline.com/webobject/1AC8A976-5056-4702-98D9-229431301805,"['https://s3.amazonaws.com/pastperfectonline/images/museum_220/005/199105-2.jpg', 'https://s3.amazonaws.com/pastperfectonline/images/museum_220/004/199105.jpg', 'https://s3.amazonaws.com/pastperfectonline/images/museum_220/005/199105-3.jpg']",Rajiv Gandhi,Plaque,,19919,A bronze plaque with a profile medallion.,H-30 W-20 feet,,Honolulu Zoo Collection,1991.05
CA5CAA85-5B2C-4A1A-82C0-688050990021,https://hiculturearts.pastperfectonline.com/webobject/CA5CAA85-5B2C-4A1A-82C0-688050990021,['https://s3.amazonaws.com/pastperfectonline/images/museum_220/005/193801-2.jpg'],"Rear Admiral Richard T. Thomas, R.N.",Plaque,Daughters of Hawaii,1938,A bronze plaque set in a stone wall in honor of Rear Admiral Richard Darton Thomas of the British Royal Navy who restored the sovereignty of King Kamehameha III in 1843. Located in Thomas Square along Beretania Street.,,Gift of the Daughters of Hawaii,City and County of Honolulu Collection,1938.01
F4383CD6-AEF7-4521-B4DB-537034343983,https://hiculturearts.pastperfectonline.com/webobject/F4383CD6-AEF7-4521-B4DB-537034343983,['https://s3.amazonaws.com/pastperfectonline/images/museum_220/003/20020102.jpg'],Red Line,"Plate, Decorative",Douglas Kenney,1995,Glazed ceramic plate.,H-38 W-38 D-2.813 Dia-38 inches,City and County of Honolulu Purchase,City & County of Honolulu,2002.01.02
31503B2D-A3F0-4344-99AA-062446700099,https://hiculturearts.pastperfectonline.com/webobject/31503B2D-A3F0-4344-99AA-062446700099,['https://s3.amazonaws.com/pastperfectonline/images/museum_220/002/19941105.jpg'],Red Orchid,Print,Dean Oshiro,1993,Color photocopier print.,H-14 W-18 inches,City & County of Honolulu Purchase,City & County of Honolulu,1994.11.05
6B21E3C8-D2DA-4ED9-AC8F-214759174306,https://hiculturearts.pastperfectonline.com/webobject/6B21E3C8-D2DA-4ED9-AC8F-214759174306,['https://s3.amazonaws.com/pastperfectonline/images/museum_220/002/19930801.jpg'],Red Steps - Kaimuki,Painting,Nancy Poes,,,H-38 W-30 inches,City & County of Honolulu Purchase,City & County of Honolulu,1993.08.01
7E9B974A-924B-4E58-8383-875812151114,https://hiculturearts.pastperfectonline.com/webobject/7E9B974A-924B-4E58-8383-875812151114,"['https://s3.amazonaws.com/pastperfectonline/images/museum_220/005/20120702-5.jpg', 'https://s3.amazonaws.com/pastperfectonline/images/museum_220/006/20120702-12.jpg', 'https://s3.amazonaws.com/pastperfectonline/images/museum_220/006/20120702-13.jpg']",Red Zigzag,Sculpture,George N. Newton,2009,A flat bisected kinetic metal sculpture in black with the two parts separated by a zigzag pattern whose reveal is colored red. The sculpture has an audible element.,H-146 W-16 D-12 inches,City and County of Honolulu Purchase,City and County of Honolulu Collection,2012.07.02
3CD6F673-9424-4F77-BC71-170306637490,https://hiculturearts.pastperfectonline.com/webobject/3CD6F673-9424-4F77-BC71-170306637490,['https://s3.amazonaws.com/pastperfectonline/images/museum_220/003/19970302.jpg'],Reef #2,Print,Louis Pohl,1997,"One of the ""Sea Series"" prints.",,Gift of Coopers and Lybrand,City & County of Honolulu Collection,1997.03.02
35EB6E03-5DB3-4A24-9C57-142355713926,https://hiculturearts.pastperfectonline.com/webobject/35EB6E03-5DB3-4A24-9C57-142355713926,['https://s3.amazonaws.com/pastperfectonline/images/museum_220/002/19930101.jpg'],Reflection of the Sun I,"Print, Photographic",Stan Tomita,1978,A framed set of four toned silver gelatin prints.,H-20.25 W-39.25 D-1.375 inches,City and County of Honolulu Purchase,City & County of Honolulu,1993.01.01
08833B4E-14DC-48EC-B485-221015475445,https://hiculturearts.pastperfectonline.com/webobject/08833B4E-14DC-48EC-B485-221015475445,['https://s3.amazonaws.com/pastperfectonline/images/museum_220/003/19951101-2.jpg'],Reflections,Painting,Jonathan Busse,1994,Acrylic on canvas painting.,H-16 W-20 inches,City & County of Honolulu Purchase,City & County of Honolulu,1995.11.01
26A57A42-8FAA-4BB4-B953-382331540335,https://hiculturearts.pastperfectonline.com/webobject/26A57A42-8FAA-4BB4-B953-382331540335,['https://s3.amazonaws.com/pastperfectonline/images/museum_220/001/198605.jpg'],Remebrance: Kauai,Print,Allyn Bromley,1985,One of a set of six serigraphs.,H-36.75 W-28.5 inches,City and County of Honolulu Purchase,City & County of Honolulu,1986.05
84EAE44F-E153-48AB-A1EB-620454844567,https://hiculturearts.pastperfectonline.com/webobject/84EAE44F-E153-48AB-A1EB-620454844567,['https://s3.amazonaws.com/pastperfectonline/images/museum_220/001/198606.jpg'],Remembrance: Hawaii,Print,Allyn Bromley,1985,One of a set of six serigraphs.,H-36.75 W-28.5 inches,City and County of Honolulu Purchase,City & County of Honolulu,1986.06
BD8C879D-030A-4E90-9E9C-433005507417,https://hiculturearts.pastperfectonline.com/webobject/BD8C879D-030A-4E90-9E9C-433005507417,['https://s3.amazonaws.com/pastperfectonline/images/museum_220/001/198602-2.jpg'],Remembrance: Lanai,Print,Allyn Bromley,1985,One of a set of six serigraphs.,H-36.75 W-28.5 inches,City and County of Honolulu Purchase,City & County of Honolulu,1986.02
B1F41A85-09D9-4283-9EA0-482446110396,https://hiculturearts.pastperfectonline.com/webobject/B1F41A85-09D9-4283-9EA0-482446110396,['https://s3.amazonaws.com/pastperfectonline/images/museum_220/001/198607-2.jpg'],Remembrance: Maui,Print,Allyn Bromley,1985,One of a set of six serigraphs.,H-36.75 W-28.5 inches,City and County of Honolulu Purchase,City & County of Honolulu,1986.07
D51ABCDA-7E7D-46A4-AEE1-745735781022,https://hiculturearts.pastperfectonline.com/webobject/D51ABCDA-7E7D-46A4-AEE1-745735781022,['https://s3.amazonaws.com/pastperfectonline/images/museum_220/001/198603.jpg'],Remembrance: Molokai,Print,Allyn Bromley,1985,One of a set of six serigraphs.,H-36.75 W-28.5 inches,City and County of Honolulu Purchase,City & County of Honolulu,1986.03
91A0345A-AD72-4BCC-B41D-848580595966,https://hiculturearts.pastperfectonline.com/webobject/91A0345A-AD72-4BCC-B41D-848580595966,['https://s3.amazonaws.com/pastperfectonline/images/museum_220/001/198604.jpg'],Remembrance: Oahu,Print,Allyn Bromley,1985,One of a set of six serigraphs.,H-36.75 W-28.5 inches,City and County of Honolulu Purchase,City & County of Honolulu,1986.04
AE8387EF-8E88-47A0-99C5-237217281719,https://hiculturearts.pastperfectonline.com/webobject/AE8387EF-8E88-47A0-99C5-237217281719,"['https://s3.amazonaws.com/pastperfectonline/images/museum_220/003/200003.jpg', 'https://s3.amazonaws.com/pastperfectonline/images/museum_220/003/200003-2.jpg']",Resting Dancer,Sculpture,Tuck Langland,2000,Three-quarter scale bronze figure of a woman resting on a bench. Located on the Neal Blaisdell Center Concert Hall lawn.,H-48 W-48 D-21 inches,Mayor's Office of Culture and the Arts Purchase,Mayor's Office of Culture and the Arts Collection,2000.03
2EF217CD-F9FC-40ED-B325-719999648730,https://hiculturearts.pastperfectonline.com/webobject/2EF217CD-F9FC-40ED-B325-719999648730,['https://s3.amazonaws.com/pastperfectonline/images/museum_220/001/197534.jpg'],Resting Trio,"Print, Photographic",Francis Haar,1975,,H-15.188 W-17.813 inches,City & County of Honolulu Purchase,City & County of Honolulu,1975.34
40044D67-E4DE-41EC-A48E-030712325747,https://hiculturearts.pastperfectonline.com/webobject/40044D67-E4DE-41EC-A48E-030712325747,['https://s3.amazonaws.com/pastperfectonline/images/museum_220/001/197526.jpg'],Revisitation,Painting,John Whyland,1975,An impressionistic acrylic on canvas painting of the side of a house with a white roof.,H-30.75 W-40.5 inches,City and County of Honolulu Purchase,City & County of Honolulu,1975.26
E4840FF6-498A-4649-8320-843380880687,https://hiculturearts.pastperfectonline.com/webobject/E4840FF6-498A-4649-8320-843380880687,"['https://s3.amazonaws.com/pastperfectonline/images/museum_220/002/199201.jpg', 'https://s3.amazonaws.com/pastperfectonline/images/museum_220/002/199201-2.jpg', 'https://s3.amazonaws.com/pastperfectonline/images/museum_220/006/199201-3.jpg', 'https://s3.amazonaws.com/pastperfectonline/images/museum_220/011/199201-73.jpg']",Rhythmic Omneity,Mural,Lucinda Shaw,1992,Glass mural made up of panels of glass. Located at the Alapai Police Station second floor courtyard.,H-8 W-28 feet,City & County of Honolulu Purchase,City & County of Honolulu,1992.01
49B11015-E899-4A6C-BF22-201974934166,https://hiculturearts.pastperfectonline.com/webobject/49B11015-E899-4A6C-BF22-201974934166,"['https://s3.amazonaws.com/pastperfectonline/images/museum_220/003/200115.jpg', 'https://s3.amazonaws.com/pastperfectonline/images/museum_220/003/200115-2.jpg']",River Street Reflections,Painting,Mark Brown,2001,"Landscape or city-scape painting of Chinatown, Honolulu with Nuuanu Stream in the foreground.",H-49 W-61 inches,CIty and County of Honolulu Purchase,Mayor's Office of Culture & the Arts Collection,2001.15
DCE9E249-6C23-472D-B822-194640095911,https://hiculturearts.pastperfectonline.com/webobject/DCE9E249-6C23-472D-B822-194640095911,['https://s3.amazonaws.com/pastperfectonline/images/museum_220/001/198505-2.jpg'],Rob's Wilderness,Drawing,Anne Miura,1982,A drypoint drawing in black and white.,H-21.125 W-17.125 inches,,City & County of Honolulu,1985.05
0A991DC6-0F89-4F64-B056-151817312755,https://hiculturearts.pastperfectonline.com/webobject/0A991DC6-0F89-4F64-B056-151817312755,"['https://s3.amazonaws.com/pastperfectonline/images/museum_220/002/199323-4.jpg', 'https://s3.amazonaws.com/pastperfectonline/images/museum_220/002/199323.jpg']",Robert W. Wilcox,Sculpture,Jan Gordon Fisher,1993,"Larger than life-size bronze figure of Robert Wilcox with plinth surmounting a painted concrete pedestal with four plaques attached. Located at Wilcox Park, Fort Street Mall and King Street.",H-89 W-53 D-52.5 inches,City and County of Honolulu Purchase,City and County of Honolulu Collection,1993.23
DD0AEF4D-4764-4250-AEC5-699791152212,https://hiculturearts.pastperfectonline.com/webobject/DD0AEF4D-4764-4250-AEC5-699791152212,['https://s3.amazonaws.com/pastperfectonline/images/museum_220/001/197557-2.jpg'],Rock on Sand,Painting,Hiroki Morinoue,,,,City & County of Honolulu Purchase,City & County of Honolulu,1975.57
0A9BC0A5-D0C2-454B-B40A-577581705910,https://hiculturearts.pastperfectonline.com/webobject/0A9BC0A5-D0C2-454B-B40A-577581705910,['https://s3.amazonaws.com/pastperfectonline/images/museum_220/001/197530-2.jpg'],Rocks,Painting,Lee Carroll,1975,,H-9.125 W-11.875 inches,,City & County of Honolulu,1975.30
7B3EF566-869F-4470-9398-518049009950,https://hiculturearts.pastperfectonline.com/webobject/7B3EF566-869F-4470-9398-518049009950,"['https://s3.amazonaws.com/pastperfectonline/images/museum_220/001/193101.jpg', 'https://s3.amazonaws.com/pastperfectonline/images/museum_220/007/193101-7.jpg', 'https://s3.amazonaws.com/pastperfectonline/images/museum_220/010/193101-3.jpg']",Roll of Honor,Plaque,P.M. Smoot,1931,"Bronze ""Roll of Honor"" plaque listing 101 Hawaii citizens killed in World War I. Located at Queen's Beach.",H-60 W-48 D-1.25 inches,,Department of Parks and Recreation Collection,1931.01
471C39EA-DF18-4304-BC0A-342324585880,https://hiculturearts.pastperfectonline.com/webobject/471C39EA-DF18-4304-BC0A-342324585880,"['https://s3.amazonaws.com/pastperfectonline/images/museum_220/001/193702.jpg', 'https://s3.amazonaws.com/pastperfectonline/images/museum_220/001/193702-3.jpg', 'https://s3.amazonaws.com/pastperfectonline/images/museum_220/001/193702-2.jpg', 'https://s3.amazonaws.com/pastperfectonline/images/museum_220/001/193702-4.jpg']",Roosevelt Portals,Gate,Harry Sims Bent,1937,"Three concrete gateways named for President Franklin Delano Roosevelt who visited Honolulu for the dedication of Ala Moana Park on July 27, 1934. Located in Ala Moana Regional Park at Atkinson Drive.",H-15 W-8 D-4 feet,,Department of Parks and Recreation Collection,1937.02
59FD512D-C44A-48D3-93D7-758251501850,https://hiculturearts.pastperfectonline.com/webobject/59FD512D-C44A-48D3-93D7-758251501850,['https://s3.amazonaws.com/pastperfectonline/images/museum_220/004/art02.jpg'],Ruins of a Fort at Kai-Kona,Engraving,,1976,,H-9.75 W-11 inches,City & Count of Honolulu Purchase,Honolulu City Council Collection,ART-02
4BD3FABF-C157-4B38-A52B-109701082610,https://hiculturearts.pastperfectonline.com/webobject/4BD3FABF-C157-4B38-A52B-109701082610,"['https://s3.amazonaws.com/pastperfectonline/images/museum_220/003/200101-2.jpg', 'https://s3.amazonaws.com/pastperfectonline/images/museum_220/005/200101-3.jpg']",Safe Haven,Sculpture,Jane de Decker,2000,Bronze sculpture of a woman with a child at her feet. Located at the Kapolei Police Station.,,City and County of Honolulu Purchase,City and County of Honolulu Collection,2001.01
B5954290-F625-47C9-AC0D-829785892507,https://hiculturearts.pastperfectonline.com/webobject/B5954290-F625-47C9-AC0D-829785892507,"['https://s3.amazonaws.com/pastperfectonline/images/museum_220/001/19770902.jpg', 'https://s3.amazonaws.com/pastperfectonline/images/museum_220/001/19770902-2.jpg']",Samoan Tapa,"Hanging, Wall",Adeline P. Huff,,Samoan tapa (bark cloth) wall hanging; patterned with twelve panels depicting geometric shapes in brown tones.,H-66 W-78 inches,City & County of Honolulu Purchase,City & County of Honolulu,1977.09.02
B6D01D97-83D3-4477-8188-879066833481,https://hiculturearts.pastperfectonline.com/webobject/B6D01D97-83D3-4477-8188-879066833481,['https://s3.amazonaws.com/pastperfectonline/images/museum_220/001/19770901.jpg'],Samoan Tapa,Sheet,Adeline P. Huff,,,H-1 W-3 inches,City & County of Honolulu Purchase,City & County of Honolulu,1977.09.01
5BE7D224-DDC7-44FD-88D5-992327791261,https://hiculturearts.pastperfectonline.com/webobject/5BE7D224-DDC7-44FD-88D5-992327791261,['https://s3.amazonaws.com/pastperfectonline/images/museum_220/001/197820.jpg'],"Samuel ""Sammy"" E. Amato Memorial Tablet",Plaque,attributed to Corky Trinidad,1978,"A carved marble tablet mounted on a basalt stone with the inscription: ""In memory of Samuel ""Sammy"" E. Amato, Mar. 24, 1906-Nov. 28, 1978. A dedicated public servant who devoted countless hours beyond the call of duty to the Neal S. Blaisdell center where he served from March 1969 to September 1978."" Located on the Neal Blaisdell Center arena lawn.",H-22.016 W-13 D-0.75 inches,,Neal S. Blaisdell Center Collection,1978.20
E803F02D-5F07-4370-936C-430152061093,https://hiculturearts.pastperfectonline.com/webobject/E803F02D-5F07-4370-936C-430152061093,"['https://s3.amazonaws.com/pastperfectonline/images/museum_220/001/197525.jpg', 'https://s3.amazonaws.com/pastperfectonline/images/museum_220/001/197525-2.jpg']",Sand Dune Lady at Sunrise,Painting,Donna Stoner,1975,A stylized seascape painting in bold colors.,H-52.813 W-70.125 D-2.938 inches,City & County of Honolulu Purchase,City & County of Honolulu,1975.25
FD257450-11BA-4D60-A150-343525019180,https://hiculturearts.pastperfectonline.com/webobject/FD257450-11BA-4D60-A150-343525019180,['https://s3.amazonaws.com/pastperfectonline/images/museum_220/001/197516-2.jpg'],Sand Searchers,Painting,Willard Lange,1975,Seascape painting of people at the shore.,H-16.5 W-18.25 inches,City & County of Honolulu Purchase,City & County of Honolulu,1975.16
B3145DFE-487C-4549-B987-133173117290,https://hiculturearts.pastperfectonline.com/webobject/B3145DFE-487C-4549-B987-133173117290,['https://s3.amazonaws.com/pastperfectonline/images/museum_220/001/197548.jpg'],Sandia Crest 107,Print,Albert Christ-Janer,1975,,H-25.5 W-35.625 D-1 inches,City & County of Honolulu Purchase,City & County of Honolulu,1975.48
2AD85A8D-76BB-4168-9163-476453510954,https://hiculturearts.pastperfectonline.com/webobject/2AD85A8D-76BB-4168-9163-476453510954,"['https://s3.amazonaws.com/pastperfectonline/images/museum_220/002/199322-3.jpg', 'https://s3.amazonaws.com/pastperfectonline/images/museum_220/002/199322.jpg', 'https://s3.amazonaws.com/pastperfectonline/images/museum_220/002/199322-2.jpg']",Sandwich Isle,Sculpture,Bob Flint,1977,"Ceramic sculpture of five curvilinear forms of assembled ceramic pieces, terracotta on concrete bases. Located at the Foster Botanical Garden Economic Garden.",H-60 W-24 L-48 inches,,City & County of Honolulu,1993.22
3857828F-DA77-4972-AD06-431481335784,https://hiculturearts.pastperfectonline.com/webobject/3857828F-DA77-4972-AD06-431481335784,['https://s3.amazonaws.com/pastperfectonline/images/museum_220/003/19970301.jpg'],Sea Cane #1,Print,Louis Pohl,1997,"One of the ""Sea Series"" prints.",,Gift of Coopers and Lybrand,City & County of Honolulu Collection,1997.03.01
1738794F-A515-43BD-80A5-155507113074,https://hiculturearts.pastperfectonline.com/webobject/1738794F-A515-43BD-80A5-155507113074,['https://s3.amazonaws.com/pastperfectonline/images/museum_220/002/19922001.jpg'],Sea Dream Series #1,Print,Wayne Levin,1991,Photograph of pilot whales diving about five miles off the Kona Coast.,H-20 W-24 inches,City and County of Honolulu Purchase,City & County of Honolulu,1992.20.01
78591F14-550F-48A9-9A53-384152974962,https://hiculturearts.pastperfectonline.com/webobject/78591F14-550F-48A9-9A53-384152974962,['https://s3.amazonaws.com/pastperfectonline/images/museum_220/002/19922003.jpg'],Sea Dream Series #16,"Print, Photographic",Wayne Levin,1990,Silver gelatin photograph of a manta ray approaching the photographer from below in Kealakekua Bay.,H-20 W-24 inches,City and County of Honolulu Purchase,City & County of Honolulu,1992.20.03
5DF213CF-34D1-47A8-9084-627260520323,https://hiculturearts.pastperfectonline.com/webobject/5DF213CF-34D1-47A8-9084-627260520323,['https://s3.amazonaws.com/pastperfectonline/images/museum_220/002/19922002.jpg'],Sea Dream Series #5,"Print, Photographic",Wayne Levin,1990,Silver gelatin photograph of spinner dolphins diving at Kealakekua Bay.,H-20 W-24 inches,City and County of Honolulu Purchase,City & County of Honolulu,1992.20.02
B6C3D194-2136-4640-8B23-471947465180,https://hiculturearts.pastperfectonline.com/webobject/B6C3D194-2136-4640-8B23-471947465180,['https://s3.amazonaws.com/pastperfectonline/images/museum_220/003/200505-3.jpg'],Sea Sky Forever,Mural,John Wisnosky,2005,"Acrylic painting on plywood depicting of divers, swimmers, surfers, windsurfers and sea life in a romantic light filled setting. Located at the Veteran's Memorial Aquatic Center.",H-180 W-108 D-1.5 inches,City and County of Honolulu Purchase,City & County of Honolulu Collection,2005.05
194CC551-F8FA-48BE-BD4D-354779833173,https://hiculturearts.pastperfectonline.com/webobject/194CC551-F8FA-48BE-BD4D-354779833173,['https://s3.amazonaws.com/pastperfectonline/images/museum_220/001/198601.jpg'],Seafood and Fruit,Print,Lei Sanne Doo,1986,A still-life print of food on a table.,H-25.75 W-31.75 inches,City and County of Honolulu Purchase,City & County of Honolulu,1986.01
F6069A8C-325F-4BB8-B9C2-503732253753,https://hiculturearts.pastperfectonline.com/webobject/F6069A8C-325F-4BB8-B9C2-503732253753,['https://s3.amazonaws.com/pastperfectonline/images/museum_220/003/200110.jpg'],Seascape,Painting,Kyung Soon,1976,,H-40 W-49.5 inches,City and County of Honolulu Purchase,City & County of Honolulu Collection,2001.10
71607538-9A50-4E15-BA7D-401901827360,https://hiculturearts.pastperfectonline.com/webobject/71607538-9A50-4E15-BA7D-401901827360,['https://s3.amazonaws.com/pastperfectonline/images/museum_220/001/197540-2.jpg'],Seascape,"Print, Photographic",Phil Uhl,1974,,H-24.875 W-20.875 inches,,City & County of Honolulu,1975.40
