objectId,objectUrl,images,title,object_name,artist,date,description,dimensions,credit_line,collection,object_number
9BF06845-84A2-4B9E-83F4-387569239613,https://hiculturearts.pastperfectonline.com/webobject/9BF06845-84A2-4B9E-83F4-387569239613,"['https://s3.amazonaws.com/pastperfectonline/images/museum_220/004/200901-2.jpg', 'https://s3.amazonaws.com/pastperfectonline/images/museum_220/004/200901-3.jpg']",Enpitsu,Sculpture,Jerry Tsukio Okimoto,1990,A sculpture depicting part of a large upright sharpened wooden pencil made of plywood and laminated white pine.,H-15.167 W-2.042 D-2.042 feet,Gift of William Gong,City & County of Honolulu Collection,2009.01
001CFB1D-E9E4-432D-854B-377445603823,https://hiculturearts.pastperfectonline.com/webobject/001CFB1D-E9E4-432D-854B-377445603823,"['https://s3.amazonaws.com/pastperfectonline/images/museum_220/003/200117.jpg', 'https://s3.amazonaws.com/pastperfectonline/images/museum_220/003/200117-2.jpg']",Eternal Flame,Monument,Benjamin Lee,2001,"Monument commemorating the events of September 11, 2001, that include an eternal flame and plaque. Structure is made of plywood covered in synthetic stone. Located in front of Honolulu Hale.",,,Mayor's Office of Culture and the Arts Collection,2001.17
A8C9B346-538A-4137-83DD-376302425690,https://hiculturearts.pastperfectonline.com/webobject/A8C9B346-538A-4137-83DD-376302425690,['https://s3.amazonaws.com/pastperfectonline/images/museum_220/002/19901102.jpg'],Every Man an Island,Print,Jon Hamblin,1990,Four screen serigraph of various colored figures with text.,H-20 W-14.75 inches,City and County of Honolulu Purchase,City & County of Honolulu,1990.11.02
5BFCD91A-BC6D-41CB-9DC3-089142191937,https://hiculturearts.pastperfectonline.com/webobject/5BFCD91A-BC6D-41CB-9DC3-089142191937,['https://s3.amazonaws.com/pastperfectonline/images/museum_220/001/197404-2.jpg'],Exodus,"Print, Photographic",Bruce Ayers,1974,Color photograph of a windblown sand with a prominent rock in the background.,H-31.25 W-25.25 inches,City and County of Honolulu Purchase,City & County of Honolulu Collection,1974.04
DDD573AB-6259-4A21-B5AE-045848294716,https://hiculturearts.pastperfectonline.com/webobject/DDD573AB-6259-4A21-B5AE-045848294716,['https://s3.amazonaws.com/pastperfectonline/images/museum_220/001/197608.jpg'],Extremes,Painting,Ruth Laird Pistor,1976,,H-39.75 W-31 inches,City & County of Honolulu Purchase,City & County of Honolulu,1976.08
836912F5-37DB-4819-A97D-553693003267,https://hiculturearts.pastperfectonline.com/webobject/836912F5-37DB-4819-A97D-553693003267,"['https://s3.amazonaws.com/pastperfectonline/images/museum_220/005/20120302b.jpg', 'https://s3.amazonaws.com/pastperfectonline/images/museum_220/005/20120302b-2.jpg']",Fa`a Samoa,Box,Saumo Puapuaga,2012,Cardboard cracker box decorated with a Samoan motif to accompany the center panel of the mixed media on canvas triptych.,H-4.5 W-9.875 D-4.375 inches,City and County of Honolulu Purchase,City and County of Honolulu Collection,2012.03.02b
C4CDEFA6-E635-43EF-9459-416136167890,https://hiculturearts.pastperfectonline.com/webobject/C4CDEFA6-E635-43EF-9459-416136167890,"['https://s3.amazonaws.com/pastperfectonline/images/museum_220/005/20120301b.jpg', 'https://s3.amazonaws.com/pastperfectonline/images/museum_220/005/20120301b-2.jpg']",Fa`a Samoa,Can,Saumo Puapuaga,2012,"Metal can containing a whole cooked chicken, the can is decorated in a Samoan motif to accompany the left panel of the mixed media on canvas triptych..",H-6.938 W-4.25 inches,City and County of Honolulu Purchase,City and County of Honolulu Collection,2012.03.01b
0EF543CF-A043-48B3-B208-040721326179,https://hiculturearts.pastperfectonline.com/webobject/0EF543CF-A043-48B3-B208-040721326179,"['https://s3.amazonaws.com/pastperfectonline/images/museum_220/005/20120303b.jpg', 'https://s3.amazonaws.com/pastperfectonline/images/museum_220/005/20120303b-2.jpg']",Fa`a Samoa,Can,Saumo Puapuaga,2012,"Aluminum metal soda pop can with a US dollar bill folded in half lengthwise tucked under the top lift tab, the can is decorated in a Samoan motif.",H-7.25 W-4.587 D-3.253 inches,City and County of Honolulu Purchase,City and County of Honolulu Collection,2012.03.03b
98DA196E-4088-4ECB-98E4-892387505724,https://hiculturearts.pastperfectonline.com/webobject/98DA196E-4088-4ECB-98E4-892387505724,"['https://s3.amazonaws.com/pastperfectonline/images/museum_220/005/20120303a.jpg', 'https://s3.amazonaws.com/pastperfectonline/images/museum_220/005/20120303a-2.jpg']",Fa`a Samoa,Painting,Saumo Puapuaga,2012,Right panel of a mixed media on canvas triptych painting depicting metal cans of soda pop in a Samoan motif.,H-48 W-60 inches,City and County of Honolulu Purchase,City and County of Honolulu Collection,2012.03.03a
94E5CB49-1997-467C-B2ED-918869506141,https://hiculturearts.pastperfectonline.com/webobject/94E5CB49-1997-467C-B2ED-918869506141,"['https://s3.amazonaws.com/pastperfectonline/images/museum_220/005/20120301a.jpg', 'https://s3.amazonaws.com/pastperfectonline/images/museum_220/005/20120301a-2.jpg']",Fa`a Samoa,Painting,Saumo Puapuaga,2012,Left panel of a mixed media on canvas triptych painting depicting metal cans containing whole cooked chickens in a Samoan motif.,H-48 W-60 inches,City and County of Honolulu Purchase,City and County of Honolulu Collection,2012.03.01a
B0C3BBF1-B70F-4CD1-ACA6-375760229370,https://hiculturearts.pastperfectonline.com/webobject/B0C3BBF1-B70F-4CD1-ACA6-375760229370,"['https://s3.amazonaws.com/pastperfectonline/images/museum_220/005/20120302a.jpg', 'https://s3.amazonaws.com/pastperfectonline/images/museum_220/005/20120302a-2.jpg']",Fa`a Samoa,Painting,Saumo Puapuaga,2012,Center panel of a mixed media on canvas triptych painting depicting taro corms in a Samoan motif.,H-48 W-60 inches,City and County of Honolulu Purchase,City and County of Honolulu Collection,2012.03.02a
1A856FD3-040A-4C7A-993D-002481233642,https://hiculturearts.pastperfectonline.com/webobject/1A856FD3-040A-4C7A-993D-002481233642,"['https://s3.amazonaws.com/pastperfectonline/images/museum_220/003/199602.jpg', 'https://s3.amazonaws.com/pastperfectonline/images/museum_220/003/003_199602.jpg', 'https://s3.amazonaws.com/pastperfectonline/images/museum_220/010/199602-3.jpg', 'https://s3.amazonaws.com/pastperfectonline/images/museum_220/010/199602-4.jpg', 'https://s3.amazonaws.com/pastperfectonline/images/museum_220/010/199602-5.jpg', 'https://s3.amazonaws.com/pastperfectonline/images/museum_220/010/199602-6.jpg', 'https://s3.amazonaws.com/pastperfectonline/images/museum_220/010/199602-7.jpg', 'https://s3.amazonaws.com/pastperfectonline/images/museum_220/010/199602-8.jpg', 'https://s3.amazonaws.com/pastperfectonline/images/museum_220/010/199602-9.jpg', 'https://s3.amazonaws.com/pastperfectonline/images/museum_220/010/199602-10.jpg', 'https://s3.amazonaws.com/pastperfectonline/images/museum_220/010/199602-11.jpg', 'https://s3.amazonaws.com/pastperfectonline/images/museum_220/010/199602-12.jpg', 'https://s3.amazonaws.com/pastperfectonline/images/museum_220/010/199602-13.jpg', 'https://s3.amazonaws.com/pastperfectonline/images/museum_220/010/199602-14.jpg', 'https://s3.amazonaws.com/pastperfectonline/images/museum_220/010/199602-15.jpg', 'https://s3.amazonaws.com/pastperfectonline/images/museum_220/010/199602-16.jpg', 'https://s3.amazonaws.com/pastperfectonline/images/museum_220/010/199602-17.jpg']",Faces of Chinatown,Mural,Linda Oszajca,1996,"Painted layered wood mural depicting people of Chinatown that are seen from the Chinatown Gateway Building. The work represents the incredible mix of people of all ages, races, and economic groups, that pass by the building daily. Located at the Chinatown Gateway Plaza lobby.",,City and County of Honolulu Purchase,City & County of Honolulu,1996.02
0FBABF61-69A9-4B2A-BFA9-811144862940,https://hiculturearts.pastperfectonline.com/webobject/0FBABF61-69A9-4B2A-BFA9-811144862940,"['https://s3.amazonaws.com/pastperfectonline/images/museum_220/003/20071407.jpg', 'https://s3.amazonaws.com/pastperfectonline/images/museum_220/003/20071407-2.jpg']",Family Market,"Print, Photographic",Brian Malanaphy,2006,"A color framed photographic print of a the Family Market in Kalihi, Oahu, Hawaii. One of a limited edition of eleven.",H-36.625 W-41.75 D-2 inches,City and County of Honolulu Purchase,City & County of Honolulu Collection,2007.14.07
1AF00A45-0DDC-4F3E-AE1B-853424041090,https://hiculturearts.pastperfectonline.com/webobject/1AF00A45-0DDC-4F3E-AE1B-853424041090,['https://s3.amazonaws.com/pastperfectonline/images/museum_220/001/197604.jpg'],Fantasy,Painting,Clare Forster,,,,City & County of Honolulu Purchase,City & County of Honolulu,1976.04
32FCC09B-FE8E-4CAD-83DD-494435881149,https://hiculturearts.pastperfectonline.com/webobject/32FCC09B-FE8E-4CAD-83DD-494435881149,"['https://s3.amazonaws.com/pastperfectonline/images/museum_220/003/199501.jpg', 'https://s3.amazonaws.com/pastperfectonline/images/museum_220/003/199501-3.jpg']",Fat Cat Spirit on a Horse,Sculpture,Esther Shimazu,,,H-10 W-5 L-11 inches,City & County of Honolulu Purchase,City & County of Honolulu,1995.01
E6054683-2BD6-4D08-824A-506955937366,https://hiculturearts.pastperfectonline.com/webobject/E6054683-2BD6-4D08-824A-506955937366,['https://s3.amazonaws.com/pastperfectonline/images/museum_220/002/199414.jpg'],Feast or Famine,Painting,Sally French,1993,Mixed media drawing using beeswax and oil on wood,H-37 W-46 inches,City & County of Honolulu Purchase,City & County of Honolulu,1994.14
1C489EAC-5845-44DA-BCBD-960323381435,https://hiculturearts.pastperfectonline.com/webobject/1C489EAC-5845-44DA-BCBD-960323381435,"['https://s3.amazonaws.com/pastperfectonline/images/museum_220/002/199104.jpg', 'https://s3.amazonaws.com/pastperfectonline/images/museum_220/002/199104-8.jpg', 'https://s3.amazonaws.com/pastperfectonline/images/museum_220/002/199104-2.jpg', 'https://s3.amazonaws.com/pastperfectonline/images/museum_220/002/199104-3.jpg', 'https://s3.amazonaws.com/pastperfectonline/images/museum_220/002/199104-4.jpg', 'https://s3.amazonaws.com/pastperfectonline/images/museum_220/002/199104-5.jpg', 'https://s3.amazonaws.com/pastperfectonline/images/museum_220/002/199104-6.jpg', 'https://s3.amazonaws.com/pastperfectonline/images/museum_220/002/199104-7.jpg', 'https://s3.amazonaws.com/pastperfectonline/images/museum_220/002/199104-9.jpg', 'https://s3.amazonaws.com/pastperfectonline/images/museum_220/002/199104-10.jpg', 'https://s3.amazonaws.com/pastperfectonline/images/museum_220/002/199104-11.jpg', 'https://s3.amazonaws.com/pastperfectonline/images/museum_220/002/199104-12.jpg', 'https://s3.amazonaws.com/pastperfectonline/images/museum_220/002/199104-15.jpg', 'https://s3.amazonaws.com/pastperfectonline/images/museum_220/002/199104-16.jpg']",Festival for World Peace Bell,Bell,Robert M. Nakamura,1991,"Japanese bell within a temple housing erected for the Festival for World Peace in Hawaii, December 10, 1991. Located at Neal S. Blaisdell Park.",H-15 W-17.667 L-17.667 feet,,Department of Parks and Recreation Collection,1991.04
52547DAD-A00B-435D-81F5-490657582750,https://hiculturearts.pastperfectonline.com/webobject/52547DAD-A00B-435D-81F5-490657582750,['https://s3.amazonaws.com/pastperfectonline/images/museum_220/003/19960402.jpg'],"Fico Fetifer, o Fico dell'Osso",Print,,1996,Framed botanical print.,H-29.75 W-23.625 inches,City and County of Honolulu Purchase,Department of Housing & Community Development,1996.04.02
FA60A69F-7511-460A-A1D2-887664169111,https://hiculturearts.pastperfectonline.com/webobject/FA60A69F-7511-460A-A1D2-887664169111,['https://s3.amazonaws.com/pastperfectonline/images/museum_220/002/198909a.jpg'],Fields of Maui,Print,Aline Feldman,,Color woodcut print. One of a diptych.,,,City & County of Honolulu,1989.09a
8BD60E62-5746-4A4F-9814-394670139837,https://hiculturearts.pastperfectonline.com/webobject/8BD60E62-5746-4A4F-9814-394670139837,['https://s3.amazonaws.com/pastperfectonline/images/museum_220/002/198909b.jpg'],Fields of Maui,Print,Aline Feldman,,Woodcut print. One of a diptych.,,,City & County of Honolulu,1989.09b
9E6A2180-4D8B-4DA7-AB50-706326139297,https://hiculturearts.pastperfectonline.com/webobject/9E6A2180-4D8B-4DA7-AB50-706326139297,"['https://s3.amazonaws.com/pastperfectonline/images/museum_220/003/20070602.jpg', 'https://s3.amazonaws.com/pastperfectonline/images/museum_220/003/20070602-2.jpg']",Filipino Sakada Centennial Tree,Plaque,,2007,"Bronze plaque ""Filipino Sakada Centennial Tree. Narra Tree commemorating the union of the Honolulu 100 and the Hawaii Filipino Centennial Committee. Dedicated on July 13, 2006. Mufi Hannemann, Mayor, City and County of Honolulu. Located at Aina Moana Beach Park, also known as Magic Island.",H-24 W-10 L-8 inches,City and County of Honolulu Purchase,Mayor's Office of Culture & the Arts Collection,2007.06.02
3C1938E0-C42F-41C2-98C6-731787904415,https://hiculturearts.pastperfectonline.com/webobject/3C1938E0-C42F-41C2-98C6-731787904415,['https://s3.amazonaws.com/pastperfectonline/images/museum_220/001/19780801.jpg'],Fire,Print,Roy Venters,1978,Mixed media triptych.,H-3 W-14 feet,,City & County of Honolulu Collection,1978.08.01
19DDA6D3-76E4-4311-9112-635195345549,https://hiculturearts.pastperfectonline.com/webobject/19DDA6D3-76E4-4311-9112-635195345549,['https://s3.amazonaws.com/pastperfectonline/images/museum_220/001/198101.jpg'],Fire and Police Memorial Plaque,Plaque,,1981,Bronze bas-relief plaque of a fireman carying a girl accompanied by a policeman. Located at the Charles Thurston Fire Training Center Courtyard.,H-60 W-36 inches,Gift of Hawaiian Memorial Park,City & County of Honolulu,1981.01
AE9E77CC-E21E-4926-955A-796793434240,https://hiculturearts.pastperfectonline.com/webobject/AE9E77CC-E21E-4926-955A-796793434240,['https://s3.amazonaws.com/pastperfectonline/images/museum_220/001/198509.jpg'],First Flight in Space by an Astronaut from Hawaii,"Certificate, Commemorative",,1985,"Award in honor of Ellison Onizuka with an original patch for ""first flight in space by an astronaut from Hawaii.""",H-22.875 W-26.875 inches,,Honolulu City Council Collection,1985.09.01
35098673-31BA-487A-A0B8-501590633145,https://hiculturearts.pastperfectonline.com/webobject/35098673-31BA-487A-A0B8-501590633145,['https://s3.amazonaws.com/pastperfectonline/images/museum_220/002/19940107.jpg'],Fish Cross,Print,Cora Yee,1991,Color screenprint.,H-25.125 W-32.75 inches,,City & County of Honolulu,1994.01.07
44925717-A01D-4536-90B0-539206116310,https://hiculturearts.pastperfectonline.com/webobject/44925717-A01D-4536-90B0-539206116310,['https://s3.amazonaws.com/pastperfectonline/images/museum_220/005/201204.jpg'],Five Palms,Print,John McCaskill,2012,A reductive woodcut print in orange hues of five palm trees with Diamond Head in the background and reflected water in the foreground.,H-30.5 W-41.375 D-1.25 inches,City and County of Honolulu Purchase,City and County of Honolulu Collection,2012.04
E1997EBD-6AE3-4483-968E-252798394065,https://hiculturearts.pastperfectonline.com/webobject/E1997EBD-6AE3-4483-968E-252798394065,['https://s3.amazonaws.com/pastperfectonline/images/museum_220/002/19930604.jpg'],Fleeting Currency - Sandalwood Trade,Print,Laura Ruby,1992,Scrennprint.,,City and County of Honolulu Purchase,City & County of Honolulu,1993.06.04
98EEC7AB-F921-4479-949F-611734353968,https://hiculturearts.pastperfectonline.com/webobject/98EEC7AB-F921-4479-949F-611734353968,"['https://s3.amazonaws.com/pastperfectonline/images/museum_220/001/19350201.jpg', 'https://s3.amazonaws.com/pastperfectonline/images/museum_220/001/19350201-2.jpg']",Floor Mosaic,Mosaic,Marguerite Louis Blasingame,1935,"Floor mosaic of twelve figures engaged in traditional Hawaiian athletic activities, done in polished black basalt set into a flagstone floor. Located at Lester McCoy Pavilion.",W-495 L-480 D-3.75 inches,Funded by the Works Progress Administration,City & County of Honolulu,1935.02.01
15061136-307A-4E60-89EE-058187759969,https://hiculturearts.pastperfectonline.com/webobject/15061136-307A-4E60-89EE-058187759969,['https://s3.amazonaws.com/pastperfectonline/images/museum_220/003/199513.jpg'],Flora Emblem #2,Painting,Alan Leitner,1994,"Oil, dry pigment, and wax painting on canvas.",H-36 W-31 inches,City & County of Honolulu Purchase,City & County of Honolulu,1995.13
1164F698-0EF9-464B-80D5-654722448740,https://hiculturearts.pastperfectonline.com/webobject/1164F698-0EF9-464B-80D5-654722448740,['https://s3.amazonaws.com/pastperfectonline/images/museum_220/002/19942301.jpg'],Flying Saucer Cats,Print,Cora Yee,1993,Lithograph screenprint with gold leaf and acrylic.,H-15.75 W-13.75 inches,City & County of Honolulu Purchase,City & County of Honolulu,1994.23.01
67B8DE1C-0735-4B43-9DB4-165575889592,https://hiculturearts.pastperfectonline.com/webobject/67B8DE1C-0735-4B43-9DB4-165575889592,['https://s3.amazonaws.com/pastperfectonline/images/museum_220/002/19942401.jpg'],Follow Your Breathing: There Is No Other,Print,Adella Islas,1993,Photoetching with chine colle.,H-18 W-24 D-1 inches,City and County of Honolulu Purchase,City & County of Honolulu,1994.24.01
28A6D911-A879-4C53-8CE6-483356806531,https://hiculturearts.pastperfectonline.com/webobject/28A6D911-A879-4C53-8CE6-483356806531,['https://s3.amazonaws.com/pastperfectonline/images/museum_220/001/198611.jpg'],Forest/Dark,Painting,John Davison,1984,A watercolor study of a view from within a stand of bamboo trees.,H-29 W-32.5 D-0.75 inches,City and County of Honolulu Purchase,City and County of Honolulu,1986.11
1A62C7CC-03DE-4E6A-8C4A-574752356273,https://hiculturearts.pastperfectonline.com/webobject/1A62C7CC-03DE-4E6A-8C4A-574752356273,"['https://s3.amazonaws.com/pastperfectonline/images/museum_220/009/19990806-4.jpg', 'https://s3.amazonaws.com/pastperfectonline/images/museum_220/003/19990806.jpg', 'https://s3.amazonaws.com/pastperfectonline/images/museum_220/003/19990806-2.jpg', 'https://s3.amazonaws.com/pastperfectonline/images/museum_220/003/19990806-3.jpg']",Fort DeRussy,Sign,Charles Palumbo,1999,Waikiki Historic Trail marker shaped like a surfboard with a porcelain enamel metal sign attached. Located along Fort DeRussy at Ala Moana Boulevard and Kalakaua Avenue.,H-6.5 W-3 D-1 feet,City and County of Honolulu Purchase,City and County of Honolulu Collection,1999.08.06
B86DD58C-E4DA-4DE4-93FB-733322277796,https://hiculturearts.pastperfectonline.com/webobject/B86DD58C-E4DA-4DE4-93FB-733322277796,['https://s3.amazonaws.com/pastperfectonline/images/museum_220/004/art09.jpg'],Four Women Relaxing,Painting,Yvonne Cheng,1975,Batik print of four Hawaiian women relaxing; stretched fabric on stretcher bar.,H-39 W-39 inches,City & County of Honolulu Purchase,Honolulu City Council Collection,ART-09
7E05E150-F6DB-4D39-8C43-532434345990,https://hiculturearts.pastperfectonline.com/webobject/7E05E150-F6DB-4D39-8C43-532434345990,"['https://s3.amazonaws.com/pastperfectonline/images/museum_220/006/197722-3.jpg', 'https://s3.amazonaws.com/pastperfectonline/images/museum_220/001/197722-2.jpg', 'https://s3.amazonaws.com/pastperfectonline/images/museum_220/001/197722.jpg']",Frank Case Judd,Plaque,Janice Judd,1977,"Plaque bearing the following description: ""This park is dedicated in memory of Frank Case Judd, 1915-1976, State Legislator 1959-1972, a man of love, character and integrity whose life enriched Hawaii and the lives of all who knew him. This plaque is given by his wife Janice, his family, classmates, colleagues and friends. October 25, 1977."" Plaque has a relief portrait and is mounted on a boulder. Located at Frank C. Judd Park, the park was former site of the American Legion Clubhouse which burned down on March 24, 1971.",H-20 W-30 D-0.75 inches,"Gift of Janice Judd and the family, classmates, colleagues and friends of Frank Case Judd",Department of Parks and Recreation Collection,1977.22
D1665588-2E24-4D1D-BCCB-373100147968,https://hiculturearts.pastperfectonline.com/webobject/D1665588-2E24-4D1D-BCCB-373100147968,['https://s3.amazonaws.com/pastperfectonline/images/museum_220/004/201101-3.jpg'],Frank Fasi Honolulu Marathon Hall of Fame Induction Plaque,Plaque,,2010,An engraved wood plaque dedicating Mayor Frank Fasi into the Honolulu Marathon Hall of Fame as a founder of the Honolulu Marathon.,H-16 W-16.125 D-1.5 inches,Gift of Joyce Fasi on behalf of the Honolulu Marathon,Mayor's Office of Culture & the Arts Collection,2011.01
D04BDD54-F3F2-4CE6-9E20-325119480349,https://hiculturearts.pastperfectonline.com/webobject/D04BDD54-F3F2-4CE6-9E20-325119480349,['https://s3.amazonaws.com/pastperfectonline/images/museum_220/001/195701.jpg'],Friendship Lantern,Lantern,Ryozo Hiranuma,1957,A carved and cast Japanese stone lantern. Located in the Honolulu Hale Japanese Garden.,H-4 feet,"Gift of the City of Yokohama, Japan",City and County of Honolulu Collection,1957.01
2F0FAC47-B307-4342-A927-984394459318,https://hiculturearts.pastperfectonline.com/webobject/2F0FAC47-B307-4342-A927-984394459318,['https://s3.amazonaws.com/pastperfectonline/images/museum_220/001/197405.jpg'],From Realm to Realm,Painting,Hiroshi Tagami,1974,Abstract painting in orange tones with a seated figure.,H-53.125 W-45.25 D-1.375 inches,City and County of Honolulu Purchase,City & County of Honolulu Collection,1974.05
28C40855-9147-4D3F-AC01-705249634680,https://hiculturearts.pastperfectonline.com/webobject/28C40855-9147-4D3F-AC01-705249634680,['https://s3.amazonaws.com/pastperfectonline/images/museum_220/001/197301.jpg'],Fukuoka Yame,Lantern,,,Stone hexagonal lantern in the Japanese Yukimi style. Located at the Foster Botanical Garden Daibutsu Terrace.,H-36 W-15 inches,"Gift of the Governor of Fukuoka, Kyushu, Japan",City & County of Honolulu,1973.01
4B0700E5-2081-4DB4-BE75-289989118007,https://hiculturearts.pastperfectonline.com/webobject/4B0700E5-2081-4DB4-BE75-289989118007,['https://s3.amazonaws.com/pastperfectonline/images/museum_220/001/197555.jpg'],Futurus,Painting,Willard Lange,1975,,H-20 W-16.4 inches,City and County of Honolulu Purchase,City & County of Honolulu,1975.55
544209B8-1D02-4D11-9469-600485601463,https://hiculturearts.pastperfectonline.com/webobject/544209B8-1D02-4D11-9469-600485601463,"['https://s3.amazonaws.com/pastperfectonline/images/museum_220/003/200102.jpg', 'https://s3.amazonaws.com/pastperfectonline/images/museum_220/003/200102-2.jpg']",Gabby Pahinui,Bust,Jan-Michelle Sawyer,1997,"Bronze bust of musician Gabby Pahinui mounted on a concrete pedestal with a bronze plaque. Plaque reads, ""Gabby 'Pops' Pahinui, 1921-1980, A legend in his own time, Gabby, with his mastery of slack-key guitar and falsetto singing style, sparked a musical renaissance throughout Hawaii. His mana continues to inspire those who love Hawaiian music. Sculpture by Jan-Michelle Sawyer."" Located near the entrance of the Waikiki Shell.",H-20 W-13.5 D-9 inches,Gift of Jan-Michelle Sawyer,City & County of Honolulu Collection,2001.02
1BA4DBB3-08C0-41F0-ABC5-149157367641,https://hiculturearts.pastperfectonline.com/webobject/1BA4DBB3-08C0-41F0-ABC5-149157367641,['https://s3.amazonaws.com/pastperfectonline/images/museum_220/002/199007.jpg'],Gabriel with Martyrs,Print,John Takami Morita,1989,Photoetching print.,,City & County of Honolulu Purchase,City & County of Honolulu,1990.07
DAD8DF8A-4D01-4582-9025-539337578961,https://hiculturearts.pastperfectonline.com/webobject/DAD8DF8A-4D01-4582-9025-539337578961,"['https://s3.amazonaws.com/pastperfectonline/images/museum_220/009/201703.jpg', 'https://s3.amazonaws.com/pastperfectonline/images/museum_220/010/201703-11.jpg', 'https://s3.amazonaws.com/pastperfectonline/images/museum_220/009/201703-2.jpg', 'https://s3.amazonaws.com/pastperfectonline/images/museum_220/009/201703-3.jpg', 'https://s3.amazonaws.com/pastperfectonline/images/museum_220/009/201703-4.jpg', 'https://s3.amazonaws.com/pastperfectonline/images/museum_220/009/201703-5.jpg', 'https://s3.amazonaws.com/pastperfectonline/images/museum_220/009/201703-6.jpg', 'https://s3.amazonaws.com/pastperfectonline/images/museum_220/009/201703-9.jpg', 'https://s3.amazonaws.com/pastperfectonline/images/museum_220/009/201703-13.jpg', 'https://s3.amazonaws.com/pastperfectonline/images/museum_220/010/201703-10.jpg']",Games of Mililani,Mural,Kaiili Kaulukukui,2017,"A painted triptych mural on panel depicted contemporary sports and traditional Hawaiian sports. The contemporary sports' team uniform reflect the colors of the Mililani High School colors and their mascot, the Trojan. The artist's birthday is September 23rd, reflected in the number 23 on the football jersey.",H-97.5 W-244.5 D-3.25 inches,City and County of Honolulu Purchase,City and County of Honolulu Collection,2017.03
