objectId,objectUrl,images,title,object_name,artist,date,description,dimensions,credit_line,collection,object_number
D52BC8E4-8802-4791-93C9-583628460237,https://hiculturearts.pastperfectonline.com/webobject/D52BC8E4-8802-4791-93C9-583628460237,['https://s3.amazonaws.com/pastperfectonline/images/museum_220/003/19952106a.jpg'],"Koki Beach Left Panel, Hana, Maui",Print,Bill Braden,1995,Serigraph,,City and County of Honolulu Purchase,Mayor's Office of Culture & the Arts Collection,1995.21.06a
FC297B23-6639-4CE6-B75C-082517286800,https://hiculturearts.pastperfectonline.com/webobject/FC297B23-6639-4CE6-B75C-082517286800,['https://s3.amazonaws.com/pastperfectonline/images/museum_220/003/19952101h.jpg'],"Koki Beach Right Panel, Hana, Maui",Painting,Bill Braden,1995,One of ten paintings in the Best Beaches of Hawaii series.,H-34 W-69 inches,City and County of Honolulu Purchase,City & County of Honolulu,1995.21.01h
D6118D2F-9607-4F20-90EC-371351474886,https://hiculturearts.pastperfectonline.com/webobject/D6118D2F-9607-4F20-90EC-371351474886,['https://s3.amazonaws.com/pastperfectonline/images/museum_220/003/19952106c.jpg'],"Koki Beach Right Panel, Hana, Maui",Print,Bill Braden,1995,Serigraph,,City and County of Honolulu Purchase,Mayor's Office of Culture & the Arts Collection,1995.21.06c
216474CB-3B73-43F3-8AAC-323108535550,https://hiculturearts.pastperfectonline.com/webobject/216474CB-3B73-43F3-8AAC-323108535550,['https://s3.amazonaws.com/pastperfectonline/images/museum_220/003/19952113b.jpg'],"Koki Beach, Hana, Maui - Triptych Center Panel",Poster,Bill Braden,1995,"Poster from Bill Braden's ""Best Beaches of Hawaii"" series.",H-12.375 W-24.5 D-0.75 inches,City and County of Honolulu Purchase,Mayor's Office of Culture & the Arts Collection,1995.21.13b
34A7FA60-DDD6-4A7B-AF93-743237548947,https://hiculturearts.pastperfectonline.com/webobject/34A7FA60-DDD6-4A7B-AF93-743237548947,['https://s3.amazonaws.com/pastperfectonline/images/museum_220/003/19952113a.jpg'],"Koki Beach, Hana, Maui - Triptych Left Panel",Poster,Bill Braden,1995,"Poster from Bill Braden's ""Best Beaches of Hawaii"" series.",H-12.375 W-24.5 D-0.75 inches,City and County of Honolulu Purchase,Mayor's Office of Culture & the Arts Collection,1995.21.13a
2B80BD8C-C979-49C5-9C52-642908133516,https://hiculturearts.pastperfectonline.com/webobject/2B80BD8C-C979-49C5-9C52-642908133516,['https://s3.amazonaws.com/pastperfectonline/images/museum_220/003/19952113c.jpg'],"Koki Beach, Hana, Maui - Triptych Right Panel",Poster,Bill Braden,1995,"Poster from Bill Braden's ""Best Beaches of Hawaii"" series.",H-12.375 W-24.5 D-0.75 inches,City and County of Honolulu Purchase,Mayor's Office of Culture & the Arts Collection,1995.21.13c
BE2A8B2A-454F-40C1-AB51-223657309096,https://hiculturearts.pastperfectonline.com/webobject/BE2A8B2A-454F-40C1-AB51-223657309096,['https://s3.amazonaws.com/pastperfectonline/images/museum_220/008/20150402.jpg'],Koko Head Park,Mural,,April 2016,A wall-mounted ceramic tile mural depicting a park scene; composed of twelve tiles; created by the Friends of Koko Head District Park and Koko Head District Park Summer Fun participants.,H-13 W-17 inches,Gift of the Friends of Koko Head District Park,City and County of Honolulu Collection,2015.04.02
B197175C-9FF5-4442-B1B7-303775462607,https://hiculturearts.pastperfectonline.com/webobject/B197175C-9FF5-4442-B1B7-303775462607,['https://s3.amazonaws.com/pastperfectonline/images/museum_220/009/20150403.jpg'],Koko Head Park,Mural,,2016,A wall-mounted ceramic tile mural depicting a park scene; composed of twelve tiles; created by the Friends of Koko Head District Park and Koko Head District Park Summer Fun participants.,H-13 W-17 inches,Gift of the Friends of Koko Head District Park,City and County of Honolulu Collection,2015.04.03
D616F5F9-08F9-421D-89DC-232414109791,https://hiculturearts.pastperfectonline.com/webobject/D616F5F9-08F9-421D-89DC-232414109791,['https://s3.amazonaws.com/pastperfectonline/images/museum_220/009/20150404.jpg'],Koko Head Park,Mural,,2017,A wall-mounted ceramic tile mural depicting a park scene; composed of twelve tiles; created by the Friends of Koko Head District Park and Koko Head District Park Summer Fun participants.,H-13 W-17 inches,Gift of the Friends of Koko Head District Park,City and County of Honolulu Collection,2015.04.04
3A86E656-2E69-446B-B9AC-396227892646,https://hiculturearts.pastperfectonline.com/webobject/3A86E656-2E69-446B-B9AC-396227892646,"['https://s3.amazonaws.com/pastperfectonline/images/museum_220/008/20150401.jpg', 'https://s3.amazonaws.com/pastperfectonline/images/museum_220/008/20150401-2.jpg']",Koko Head Park Children's Ceramics,Mural,Ms. Ida,November 2015,A wall-mounted ceramic tile mural depicting a park scene; composed of twelve tiles; created by the Friends of Koko Head District Park and Koko Head District Park Summer Fun participants.,H-13 W-17 inches,Gift of the Friends of Koko Head District Park,City and County of Honolulu Collection,2015.04.01
115B0AF9-9E80-4986-83E5-249170195215,https://hiculturearts.pastperfectonline.com/webobject/115B0AF9-9E80-4986-83E5-249170195215,['https://s3.amazonaws.com/pastperfectonline/images/museum_220/002/19940601.jpg'],Konahuanui,"Print, Photographic",Anne Landgraf,1989,Silver gelatin print of a drive-in movie theater.,H-23 W-28 inches,City and County of Honolulu Purchase,City & County of Honolulu,1994.06.01
5B42B616-1FA7-4D3B-8C6D-547209802840,https://hiculturearts.pastperfectonline.com/webobject/5B42B616-1FA7-4D3B-8C6D-547209802840,['https://s3.amazonaws.com/pastperfectonline/images/museum_220/002/198904.jpg'],Koolau Mountains,Painting,John Young,1988,An abstract impressionist image of the Koolau Mountains as seen from the Windward side of Oahu.,H-69 W-69 inches,City and County of Honolulu Purchase,City & County of Honolulu Collection,1989.04
28178049-E7C6-4A0A-9216-354509309346,https://hiculturearts.pastperfectonline.com/webobject/28178049-E7C6-4A0A-9216-354509309346,"['https://s3.amazonaws.com/pastperfectonline/images/museum_220/003/200301.jpg', 'https://s3.amazonaws.com/pastperfectonline/images/museum_220/003/200301-2.jpg', 'https://s3.amazonaws.com/pastperfectonline/images/museum_220/003/003_200301.jpg', 'https://s3.amazonaws.com/pastperfectonline/images/museum_220/003/200301-4.jpg', 'https://s3.amazonaws.com/pastperfectonline/images/museum_220/003/200301-5.jpg', 'https://s3.amazonaws.com/pastperfectonline/images/museum_220/003/200301-6.jpg', 'https://s3.amazonaws.com/pastperfectonline/images/museum_220/003/200301-7.jpg', 'https://s3.amazonaws.com/pastperfectonline/images/museum_220/004/200301-8.jpg', 'https://s3.amazonaws.com/pastperfectonline/images/museum_220/004/200301-9.jpg']",Korean Centennial Memorial,Monument,Bon Chan Park,2003,"Stone and metal monument commemorating the 100th anniversary of Korean immigration to Hawaii and the United States of America. The tall stone represents Korea; the smaller stone, in the shape of Diamond Head, symbolizes the United States, specifically Hawaii. The greenish bronze element adjacent to the tall stone conveys the crooked backs of laborers and the tools of plantation workers. The other greenish bronze element represents the prow of an immigrant ship and the high hopes for the future. The small angular stones depict the Hawaiian islands. The embedded white stones represent the more than 7,000 early Korean immigrants to the United States. The circular perimeter provides a sense of harmony and conveys the friendship between Korea and the United States. Located at Pawaa Inha Neighborhood Park.",H-1.08 W-252 D-144 inches,Gift of the 2003 Centennial Committee of Korean Immigration to the United States of America,City and County of Honolulu Collection,2003.01
BAF0EE73-64CB-4D79-AB08-153113679338,https://hiculturearts.pastperfectonline.com/webobject/BAF0EE73-64CB-4D79-AB08-153113679338,['https://s3.amazonaws.com/pastperfectonline/images/museum_220/004/200301b.jpg'],Korean Centennial Memorial,Plaque,,2003,Bronze plaque commemorating the 100th anniversary of Korean immigration to Hawaii and the United States of America. Located at Pawaa Neighborhood Park.,H-24 W-16 inches,Gift of the 2003 Centennial Committee of Korean Immigration to the United States of America,City and County of Honolulu,2003.01b
D021F091-E59C-4364-82D4-555447615826,https://hiculturearts.pastperfectonline.com/webobject/D021F091-E59C-4364-82D4-555447615826,['https://s3.amazonaws.com/pastperfectonline/images/museum_220/003/20030302ca.jpg'],Kozuke Province: Mount Haruna Under Snow,Print,Utagawa Hiroshige,,"Wood block print of a landscape during winter. Scene contains a red bridge and red building, a brown building, four people, snow falling and a blue river. Two rectangles, both red hue, in upper right corner containing Japanese lettering. A small version of an original print from the series ""Famous Places in the Sixty-Odd Provinces"" from 1853.",H-20.125 W-16.125 D-0.75 inches,,Mayor's Office of Culture & the Arts Collection,2003.03.02
37C7FCA9-D2C3-4478-ADFF-343834355354,https://hiculturearts.pastperfectonline.com/webobject/37C7FCA9-D2C3-4478-ADFF-343834355354,['https://s3.amazonaws.com/pastperfectonline/images/museum_220/002/19910108a-2.jpg'],"Kuhi No Ka Lima, Hele No Ka Maka",Print,Dietrich Varez,1991,Woodblock print in brown tones depicting three male hula dancers.,H-23.563 W-29.125 D-0.875 inches,,City & County of Honolulu,1991.01.08a
319F822F-ABDF-49BC-9D4D-553158313261,https://hiculturearts.pastperfectonline.com/webobject/319F822F-ABDF-49BC-9D4D-553158313261,['https://s3.amazonaws.com/pastperfectonline/images/museum_220/002/19910108b-2.jpg'],"Kuhi No Ka Lima, Hele No Ka Maka",Print,Dietrich Varez,1991,Woodblock print.,,,City & County of Honolulu,1991.01.08b
71A90DBA-4E54-41CB-8D6C-237995982801,https://hiculturearts.pastperfectonline.com/webobject/71A90DBA-4E54-41CB-8D6C-237995982801,['https://s3.amazonaws.com/pastperfectonline/images/museum_220/003/200011.jpg'],Kuhio Beach Park,Plaque,Sonny T. Okada,2000,Bronze dedication plaque of Kuhio Beach improvements completed in 2000.,,City and County of Honolulu Purchase,Department of Parks and Recreation Collection,2000.11
B91E33B5-9CE7-4252-BF77-703669107180,https://hiculturearts.pastperfectonline.com/webobject/B91E33B5-9CE7-4252-BF77-703669107180,['https://s3.amazonaws.com/pastperfectonline/images/museum_220/001/198622.jpg'],Kukui Frog,"Print, Photographic",Stan Tomita,,Black and white photograph of a forest scene.,H-23.25 W-27.25 D-1.5 inches,City & County of Honolulu Purchase,City & County of Honolulu,1986.22
C254E7DE-B628-4413-9AC0-263527380772,https://hiculturearts.pastperfectonline.com/webobject/C254E7DE-B628-4413-9AC0-263527380772,"['https://s3.amazonaws.com/pastperfectonline/images/museum_220/001/198506.jpg', 'https://s3.amazonaws.com/pastperfectonline/images/museum_220/001/198506-2.jpg', 'https://s3.amazonaws.com/pastperfectonline/images/museum_220/001/198506-6.jpg']",Kulamanu,Sculpture,Ernest DeCoito,1987,"The sculpture represents one of the purposes of the Fire Training Center-to accomplish a given goal through team work and individual sacrifice. The sculpture is an assembled piece consisting of combined individual parts working together to depict a recognizable form. Kulamanu is translated as a place where birds gather, a coming together, or gathering place. The choice of a bird form was a creative decision by the artist. It was not intended to signify a specific bird or make a statement. Located in the Charles Thurston Fire Training Center courtyard.",H-80 W-42 L-92 D-29.5 inches,City and County of Honolulu Purchase,City & County of Honolulu,1985.06
EA71D27D-4D17-4AB1-94D5-351301937028,https://hiculturearts.pastperfectonline.com/webobject/EA71D27D-4D17-4AB1-94D5-351301937028,['https://s3.amazonaws.com/pastperfectonline/images/museum_220/001/19781501.jpg'],Kupuna Kane (Grandfather),Painting,Terrence William Shea,1977,"Stylized scene of a seated male elder surrounded by blue birds. One of a suite of four oil paintings titled ""Na Paka Olu Olu"" (Pleasant Parks).",H-29.5 W-35.5 D-1.25 inches,Funded in part by the Comprehensive Employment Training Act,City & County of Honolulu Collection,1978.15.01
E6A03007-2E59-46A8-B6B5-131593070010,https://hiculturearts.pastperfectonline.com/webobject/E6A03007-2E59-46A8-B6B5-131593070010,['https://s3.amazonaws.com/pastperfectonline/images/museum_220/005/19690206.jpg'],"La Perspective du Jardin des Marchands, a l'une des portes de Paris",Print,,1766,"Hand colored 18th century ""Vue Optique"" print of a formal European garden.",H-11 W-17.25 inches,Gift of Francis MacKinnon Damon,Department of Parks & Recreation Collection,1969.02.06
12A5D2C6-E032-4918-B9DD-090224024650,https://hiculturearts.pastperfectonline.com/webobject/12A5D2C6-E032-4918-B9DD-090224024650,['https://s3.amazonaws.com/pastperfectonline/images/museum_220/001/197402.jpg'],Lakeside,Painting,David Lee,1974,Watercolor painting of a coastline in mist.,H-25.125 W-37.25 inches,City & County of Honolulu Purchase,City & County of Honolulu,1974.02
29FFB3E0-FD31-41E4-8C87-390665234170,https://hiculturearts.pastperfectonline.com/webobject/29FFB3E0-FD31-41E4-8C87-390665234170,['https://s3.amazonaws.com/pastperfectonline/images/museum_220/003/199520.jpg'],Land Space XLII,Engraving,Hiroki Morinoue,1991,Color etching print.,H-34 W-26 inches,City and County of Honolulu Purchase,City & County of Honolulu,1995.20
B482BA84-ECAC-4839-A0A8-925385860472,https://hiculturearts.pastperfectonline.com/webobject/B482BA84-ECAC-4839-A0A8-925385860472,"['https://s3.amazonaws.com/pastperfectonline/images/museum_220/008/197513-12.jpg', 'https://s3.amazonaws.com/pastperfectonline/images/museum_220/001/197513.jpg']",Land of Lands #13,Collage,Fung Ching Kelling,1975,An abstract collage.,H-48 W-41 D-2 inches,City and County of Honolulu Purchase,City & County of Honolulu,1975.13
9CD18359-1919-43A0-BCBC-243544148246,https://hiculturearts.pastperfectonline.com/webobject/9CD18359-1919-43A0-BCBC-243544148246,['https://s3.amazonaws.com/pastperfectonline/images/museum_220/001/197501.jpg'],Landscape #10,Painting,Lee Ables,1975,Stylized cubist landscape painting in dark tones.,H-23.875 W-31.938 D-1.25 inches,City & County of Honolulu Purchase,City & County of Honolulu,1975.01
CC3F0E4E-7090-48D2-B64B-369226143113,https://hiculturearts.pastperfectonline.com/webobject/CC3F0E4E-7090-48D2-B64B-369226143113,['https://s3.amazonaws.com/pastperfectonline/images/museum_220/003/19952101i.jpg'],Lanikai,Painting,Bill Braden,1995,One of ten paintings in the Best Beaches of Hawaii series.,H-34 W-34 inches,City and County of Honolulu Purchase,City & County of Honolulu,1995.21.01i
08D42A21-F5D7-4D5E-83EC-424328734336,https://hiculturearts.pastperfectonline.com/webobject/08D42A21-F5D7-4D5E-83EC-424328734336,['https://s3.amazonaws.com/pastperfectonline/images/museum_220/003/19952109.jpg'],Lanikai,Poster,Bill Braden,1995,"Poster from Bill Braden's ""Best Beaches of Hawaii"" series.",H-20.375 W-16.875 D-0.75 inches,City and County of Honolulu Purchase,Mayor's Office of Culture & the Arts Collection,1995.21.09
07CE2842-A68E-4436-BA80-834767248939,https://hiculturearts.pastperfectonline.com/webobject/07CE2842-A68E-4436-BA80-834767248939,['https://s3.amazonaws.com/pastperfectonline/images/museum_220/003/19952107.jpg'],Lanikai,Print,Bill Braden,1995,Serigraph print of a tropical seascape.,H-21.25 W-20.25 inches,City and County of Honolulu Purchase,Mayor's Office of Culture & the Arts Collection,1995.21.07
5D619C8D-81DD-4034-BF7A-144579256939,https://hiculturearts.pastperfectonline.com/webobject/5D619C8D-81DD-4034-BF7A-144579256939,['https://s3.amazonaws.com/pastperfectonline/images/museum_220/002/198707-2.jpg'],Lanikai Afternoon,Painting,Russell Lowrey,1986,,H-29.5 W-42.5 inches,City & County of Honolulu Purchase,City & County of Honolulu,1987.07
ECCB4E3A-3C18-4806-A3CE-121233121133,https://hiculturearts.pastperfectonline.com/webobject/ECCB4E3A-3C18-4806-A3CE-121233121133,['https://s3.amazonaws.com/pastperfectonline/images/museum_220/002/19931201.jpg'],Largamente,Painting,Ka-Ning Fong,1991,,H-38 W-48 inches,City and County of Honolulu Purchase,City & County of Honolulu,1993.12.01
B53C9E18-2474-4FD4-87FF-425048410131,https://hiculturearts.pastperfectonline.com/webobject/B53C9E18-2474-4FD4-87FF-425048410131,['https://s3.amazonaws.com/pastperfectonline/images/museum_220/004/20090303.jpg'],Last Look,"Print, Photographic",Thomas S. Garcia,1987,"Photographic print on paper if the Honolulu Rapid Transit Building located on Alapai Street, taken between 1987 and 1992 during the demolition of the Honolulu Rapid Transit Building and the construction of the Alapai Police Station.",H-8.5 W-11 inches,Gift of Thomas S. Garcia,City & County of Honolulu Collection,2009.03.03
616209B8-C599-4C13-85B2-818432623085,https://hiculturearts.pastperfectonline.com/webobject/616209B8-C599-4C13-85B2-818432623085,['https://s3.amazonaws.com/pastperfectonline/images/museum_220/001/197505.jpg'],Last Year's Garden,Drawing,Lynn Cook,1973,A drawing of a flower among ferns.,H-26.25 W-18.25 D-0.75 inches,City and County of Honolulu Purchase,City & County of Honolulu,1975.05
B89C01B4-36B3-4249-92DE-474441343010,https://hiculturearts.pastperfectonline.com/webobject/B89C01B4-36B3-4249-92DE-474441343010,"['https://s3.amazonaws.com/pastperfectonline/images/museum_220/007/0001810-2.jpg', 'https://s3.amazonaws.com/pastperfectonline/images/museum_220/001/0001810.jpg']",Laupahoehoe,Painting,Kyung Soon,1976,Landscape painting.,H-22.25 W-26.25 D-2.25 inches,City and County of Honolulu Purchase,Honolulu City Council Collection,0001-810
A7CDE946-03F5-4028-8115-901349852637,https://hiculturearts.pastperfectonline.com/webobject/A7CDE946-03F5-4028-8115-901349852637,['https://s3.amazonaws.com/pastperfectonline/images/museum_220/001/19780802.jpg'],Lava,Print,Roy Venters,1978,Mixed media triptych.,H-3 W-14 feet,,City & County of Honolulu Collection,1978.08.02
25797C21-FFBA-4097-9308-824693051240,https://hiculturearts.pastperfectonline.com/webobject/25797C21-FFBA-4097-9308-824693051240,['https://s3.amazonaws.com/pastperfectonline/images/museum_220/002/19931503.jpg'],"Lava Entering the Ocean, Hawaii, 1991","Print, Photographic",Linda S. Connor,1991,Silver gelatin print. Photograph taken at Volcanoes National Park.,,City and County of Honolulu Purchase,City & County of Honolulu,1993.15.03
88D117F4-8714-4E78-A8CB-644520656770,https://hiculturearts.pastperfectonline.com/webobject/88D117F4-8714-4E78-A8CB-644520656770,['https://s3.amazonaws.com/pastperfectonline/images/museum_220/002/19910119.jpg'],Leho He'e,Print,Dietrich Varez,1991,Woodblock print on paper of two men fishing for octopus from a canoe in the ocean.,H-31.625 W-25.625 D-0.875 inches,,City & County of Honolulu Collection,1991.01.19
2337FE69-F36B-4E12-9B8B-532989246120,https://hiculturearts.pastperfectonline.com/webobject/2337FE69-F36B-4E12-9B8B-532989246120,"['https://s3.amazonaws.com/pastperfectonline/images/museum_220/003/20071405.jpg', 'https://s3.amazonaws.com/pastperfectonline/images/museum_220/003/20071405-2.jpg']",Leong's Cafe Hawaiian Food,"Print, Photographic",Brian Malanaphy,2006,"A color framed photographic print of Leong's Cafe in Kalihi, Oahu, Hawaii. One of a limited edition of eleven.",H-36.75 W-48.25 D-2 inches,City and County of Honolulu Purchase,City & County of Honolulu Collection,2007.14.05
56051E3E-F696-4CA5-B577-156731752085,https://hiculturearts.pastperfectonline.com/webobject/56051E3E-F696-4CA5-B577-156731752085,['https://s3.amazonaws.com/pastperfectonline/images/museum_220/002/19941203.jpg'],Les Betes du Ciel,Print,Cora Yee,1993,Lithograph screenprint with gold leaf and acrylic.,H-22 W-30 inches,City and County of Honolulu Purchase,City & County of Honolulu,1994.12.03
6DBADC31-48DA-4E06-9114-740080828716,https://hiculturearts.pastperfectonline.com/webobject/6DBADC31-48DA-4E06-9114-740080828716,"['https://s3.amazonaws.com/pastperfectonline/images/museum_220/001/193401-2.jpg', 'https://s3.amazonaws.com/pastperfectonline/images/museum_220/001/193401.jpg', 'https://s3.amazonaws.com/pastperfectonline/images/museum_220/001/193401-3.jpg']",Lester McCoy,Plaque,Kate Kelly,1934,Lester McCoy Pavilion dedication plaque.,H-39.25 W-24.75 inches,,City & County of Honolulu Collection,1934.01
8509A2E0-1304-49FA-8242-962031552158,https://hiculturearts.pastperfectonline.com/webobject/8509A2E0-1304-49FA-8242-962031552158,['https://s3.amazonaws.com/pastperfectonline/images/museum_220/001/197567.jpg'],Lestor McCoy Pavilion,Plaque,,1975,Bronze plaque relating the history of the Lestor McCoy Pavilion.,H-23.875 W-33.875 D-0.625 inches,,City & County of Honolulu Collection,1975.67
A8CB73A2-E350-4D61-96A8-454655643808,https://hiculturearts.pastperfectonline.com/webobject/A8CB73A2-E350-4D61-96A8-454655643808,['https://s3.amazonaws.com/pastperfectonline/images/museum_220/002/19942603.jpg'],Light Space,Print,Faith Milnes,1993,Lithograph.,H-18 W-24 inches,City and County of Honolulu Purchase,City & County of Honolulu,1994.26.03
4D31D359-DF02-4CEC-A0F7-861853218579,https://hiculturearts.pastperfectonline.com/webobject/4D31D359-DF02-4CEC-A0F7-861853218579,['https://s3.amazonaws.com/pastperfectonline/images/museum_220/001/197515-2.jpg'],Light Touches,Painting,Jewel Lafferty,1975,A landscape painting featuring mountains.,H-28.75 W-21.75 inches,City and County of Honolulu Purchase,City & County of Honolulu,1975.15
0199EEB8-E2F3-4819-B5B2-234103378440,https://hiculturearts.pastperfectonline.com/webobject/0199EEB8-E2F3-4819-B5B2-234103378440,"['https://s3.amazonaws.com/pastperfectonline/images/museum_220/002/199405.jpg', 'https://s3.amazonaws.com/pastperfectonline/images/museum_220/002/199405-2.jpg']",Lightning Lunch,Sculpture,Suzanne Wolfe,1985,"Terracotta glazed whiteware cat with a bowl on its base. This low fire ceramic work was assembled from several wheel-thrown, coil and slab built parts.""I have a cat who loves to eat - anything - even lightning."" - Suzanne Wolfe",H-30 W-30 L-36 inches,City & County of Honolulu Purchase,City & County of Honolulu,1994.05
3CAFC529-AC14-4F68-9FFE-778701398017,https://hiculturearts.pastperfectonline.com/webobject/3CAFC529-AC14-4F68-9FFE-778701398017,"['https://s3.amazonaws.com/pastperfectonline/images/museum_220/006/197568.jpg', 'https://s3.amazonaws.com/pastperfectonline/images/museum_220/006/197568-2.jpg', 'https://s3.amazonaws.com/pastperfectonline/images/museum_220/006/197568-3.jpg']",Lilinoe - Goddess of the Mist,Painting,Jon DeMello,1975,"An abstract painting of a Hawaiian goddess in white and rose tones, of heavily built up paint.",H-32.5 W-35 D-0.25 inches,Gift of John Henry Felix,Board of Water Supply Collection,1975.68
C30B352F-E16C-47E0-809D-565547942498,https://hiculturearts.pastperfectonline.com/library/C30B352F-E16C-47E0-809D-565547942498,[],,,,,,,,,
21881B20-823B-4469-AE4A-559941380200,https://hiculturearts.pastperfectonline.com/library/21881B20-823B-4469-AE4A-559941380200,[],,,,,,,,,
AB10B5E2-287F-421A-92C0-694481471614,https://hiculturearts.pastperfectonline.com/webobject/AB10B5E2-287F-421A-92C0-694481471614,['https://s3.amazonaws.com/pastperfectonline/images/museum_220/001/197503-2.jpg'],Little Seamstress,Print,Jean Charlot,1974,"Color lithograph in reddish brown, purple, and yellow brown. Drawn in Venepal, Venezuela, and in Honolulu. Printed in Los Angeles.",H-31.125 W-25.25 D-1.375 inches,City and County of Honolulu Purchase,City & County of Honolulu,1975.03
FF710C7C-0128-45F4-833D-757366580597,https://hiculturearts.pastperfectonline.com/webobject/FF710C7C-0128-45F4-833D-757366580597,['https://s3.amazonaws.com/pastperfectonline/images/museum_220/002/199001-2.jpg'],Lizzy's Nightgown,Print,Laura Smith,1990,Woodcut print.,,City & County of Honolulu Purchase,City & County of Honolulu,1990.01
2A43326C-0410-4D0A-BED2-823801761200,https://hiculturearts.pastperfectonline.com/webobject/2A43326C-0410-4D0A-BED2-823801761200,['https://s3.amazonaws.com/pastperfectonline/images/museum_220/002/19901107-3.jpg'],Local Girl,Print,Michael Harada,1990,Screen print in black of woman holding child.,H-20 W-15 inches,City and County of Honolulu Purchase,City & County of Honolulu,1990.11.07
95CDD5B6-72F2-49EB-B7BA-899452469051,https://hiculturearts.pastperfectonline.com/webobject/95CDD5B6-72F2-49EB-B7BA-899452469051,['https://s3.amazonaws.com/pastperfectonline/images/museum_220/001/197537-2.jpg'],Looking Up Royal Brewery,"Print, Photographic",Randy Fujimori,1975,"A color photograph looking up the red brick wall of the Honolulu Brewery building on Queen Street in Honolulu, Hawaii.",H-8.938 W-10.938 inches,,City & County of Honolulu,1975.37.01
1D237CCC-DF4C-49F7-AA13-831977667708,https://hiculturearts.pastperfectonline.com/webobject/1D237CCC-DF4C-49F7-AA13-831977667708,"['https://s3.amazonaws.com/pastperfectonline/images/museum_220/001/196703.jpg', 'https://s3.amazonaws.com/pastperfectonline/images/museum_220/001/196703-2.jpg']",Louise Dillingham Memorial Fountain,"Fountain, Water",Albert Ely Ives,1967,Tiered circular water fountain given in memory of Walter A. Dillingham. Located in Kapiolani Park along Kalakaua Avenue.,H-12 Dia-20 feet,Gift of the Walter and Louise Dillingham Foundation,Department of Parks and Recreation Collection,1967.03
EF3CC367-D529-4F5E-8CD4-076685259583,https://hiculturearts.pastperfectonline.com/webobject/EF3CC367-D529-4F5E-8CD4-076685259583,['https://s3.amazonaws.com/pastperfectonline/images/museum_220/004/art13.jpg'],"Low, Low, Low Tide at Kaneohe Bay",Painting,Pil Soon Conklin,1976,,H-24 W-30 inches,City & County of Honolulu Purchase,Honolulu City Council Collection,ART-13
E9397294-5B05-42DC-A704-957354370757,https://hiculturearts.pastperfectonline.com/webobject/E9397294-5B05-42DC-A704-957354370757,['https://s3.amazonaws.com/pastperfectonline/images/museum_220/004/art26.jpg'],Luau I,Print,Jinja Kim Paik,1976,,H-14.5 W-12.25 inches,City and County of Honolulu Purchase,Honolulu City Council Collection,ART-26
